Artist, Song Name,Lyrics
Passion,Almighty ," Can you remember ever having any fun? Cause when all it's all said and done I always believed we were But now I'm not so sure   I drink a gin and take a couple of my pills Then my parade will give you chills No honey, don't give me up I know we've had enough   You should go if you want to Yeah, go if you want to I'll be alright, be alright Well I've made so many messes And this love has grown so restless Your whole life's been nothing but this I won't let you go unless I'll be alright, I'll be alright   I'm so self loathing that it's hard for me to see Reality from what I dream Now no one believes me No not a single thing   My brain is racing and I feel like I'll explode You’re looking at me from below This world wasn't made for you Just go find someone new   You should go if you want to Yeah, go if you want to I'll be alright, be alright Well I've made so many messes And this love has grown so restless Your whole life's been nothing but this I won't let you go unless I'll be alright, I'll be alright   Why do I keep hounding on this suffering? My heads gone off now all my thoughts are stumbling This party’s over, no it isn’t happening No wind in the sails until I’m fully recovering   You should go if you want to Yeah, go if you want to I'll be alright, be alright Well I've made so many messes And this love has grown so restless Your whole life's been nothing but this I won't let you go unless I'll be alright, I'll be alright  I'll be alright, I'll be alright"
Chris Tomlin,Crown Him (Majesty)," Crown him with many crowns The lamb upon His throne Hark! How the heavenly anthem drowns All music but its own; Awake my soul and sing Of Him who died for me And hail him as thy matchless king Through all eternity   Majesty, Lord of all Let every throne before Him fall The King of kings, O come adore Our God who reigns forevermore   Crown Him Lord of life Who triumphed o'er the grave And rose victorious in the strife For those He came to save; His glories now we sing Who died and rose on high Who died eternal life to bring And lives that death may die   Majesty, Lord of all Let every throne before Him fall The King of kings, O come adore Our God who reigns forevermore   All hail, Redeemer, hail For He has died for me His praise and glory shall not fail Throughout eternity   Majesty, Lord of all Let every throne before Him fall The King of kings, O come adore Our God who reigns forevermore"
Passion,In Christ Alone ," In Christ alone my hope is found He is my light, my strength, my song This cornerstone, this solid ground Firm through the fiercest drought and storm What heights of love, what depths of peace When fears are stilled, when strivings cease My comforter, my all in all Here in the love of Christ I stand   Oh-oh-oh-oh-oh-oh-oh-oh-oh Oh-oh-oh-oh-oh-oh-oh-oh-oh Oh-oh-oh-oh-oh-oh-oh-oh-oh Oh-oh-oh-oh-oh-oh-oh-oh-oh   There in the ground His body lay Light of the world by darkness slain Then bursting forth in glorious day Up from the grave He rose again And as He stands in victory Sin’s curse has lost its grip on me For I am His and He is mine Bought with the precious blood of Christ   Oh-oh-oh-oh-oh-oh-oh-oh-oh Oh-oh-oh-oh-oh-oh-oh-oh-oh Oh-oh-oh-oh-oh-oh-oh-oh-oh Oh-oh-oh-oh-oh-oh-oh-oh-oh   No guilt in life, no fear in death This is the power of Christ in me From life’s first cry to final breath Jesus commands my destiny No power of hell, no scheme of man Can ever pluck me from His hand Til He returns or calls me home Here in the power of Christ I’ll stand   Oh-oh-oh-oh-oh-oh-oh-oh-oh Oh-oh-oh-oh-oh-oh-oh-oh-oh In Christ aloh-oh-oh-oh-oh-oh-ohne Oh-oh-oh-oh-oh-oh-oh-oh-oh   I find my strength, I find my hope I find my help in Christ alone When fear assails, when darkness falls I find my peace in Christ alone I give my life, I give my all I sing this song to Christ alone The King of kings, the Lord I love All heaven signs to Christ alone To Christ alone, to Christ alone   Till He returns or calls me home Here in the power of Christ I’ll stand Here in the power of Christ we stand"
Hillsong Worship,Rise ,"   All the earth come alive, lift your eyes to the morning Let our hearts beat again with a lifeblood that never fails Your love, it will never fail   Breaking down the divide in a holy collision The Divine in disguise took the cross for our sin and shame Our God, You will never fail   See the lost in return, swing the doors ever wider See the tide, as it turns, love and mercy is on the rise As the world folds into Your light All creation will see Your light     Hear the sound of freedom rise as our song breaks the silence Echoing the angel cry, let us lift up Your holy Name Here-after to sing Your praise Forever and ever   We will hold, we will love, we will fall in surrender We will rise, we will run, we will live to declare Your Name Forever to bring You praise Forever we'll lift up Your Name   The universe on its knees, see the stars in surrender God above kings and queens, every idol will bend and break But our God, You will never fail Forever and ever   We will hold, we will love, we will fall in surrender We will rise, we will run, we will live to declare Your Name Forever to bring You praise Jesus, Jesus  We will hold, we will love, we will fall in surrender We will rise, we will run, we will live to declare Your Name Forever to bring You praise Forever we'll lift up Your Name   Swing the doors wider Sound the praise louder All our hearts cry out For the glory of Your Name Our God, You will never fail Lift the Name higher Shine the light brighter All the earth cry out For the glory of Your Name Our God, You will never fail   We will hold, we will love, we will fall in surrender We will rise, we will run, we will live to declare Your Name Forever to bring You praise   Swing the doors wider Sound the praise louder All our hearts cry out For the glory of Your Name Our God, You will never fail  Lift the Name higher Shine the light brighter All the earth cry out For the glory of Your Name Our God, You will never fail   Forever we'll lift up Your Name"
New Life Worship,Great I Am ," I want to be close, close to Your side So Heaven is real and death is a lie I want to hear voices, of angels above Singing as one   Hallelujah, holy holy God Almighty, Great I AM Who is worthy? None beside Thee God Almighty, Great I AM   I want to be near, near to Your heart Loving the world, hating the dark I want to see dry bones living again Singing as one   Hallelujah, holy holy God Almighty, the Great I AM Who is worthy? None beside Thee God Almighty, the Great I AM He's the Great I AM, the Great I AM   The mountains shake before Him The demons run and flee At the mention of the name, King of Majesty There is no power in hell Or any who can stand Before the power and the presence of the Great I AM The Great I AM, the Great I AM The Great I AM, the Great I AM The Great I AM   Hallelujah, holy holy God Almighty, the Great I AM Who is worthy? None beside Thee God Almighty, the Great I AM The Great I AM The Great I AM The Great I AM   The mountains shake before Him The demons run and flee At the mention of the name, King of Majesty There is no power in hell Or any who can stand Before the power and the presence of the Great I AM The Great I AM, the Great I AM The Great I AM, the Great I AM The Great I AM   Hallelujah, holy holy God Almighty, the Great I AM Who is worthy? None beside Thee God Almighty, the Great I AM The Great I AM The Great I AM The Great I AM"
Elevation Worship,I Will Look Up," All the worries of this world I will lay them at Your feet Surrender every anxious thought For perfect peace, Your perfect peace   All the loved ones I hold dear All my hopes and dreams and all my fears I will choose to trust Your name In everything, with everything   I will look up for there is none above You I will bow down to tell you that I need You Jesus, Lord of all Jesus, Lord of all   I will take You at Your Word For Jesus, You have taken hold of me All my life is in Your hands You are my strength, You are my strength   I will look up for there is none above You I will bow down to tell you that I need You Jesus, Lord of all Jesus, Lord of all  I will look back and see that You are faithful I look ahead believing You are able Jesus, Lord of all Jesus, Lord of all  Lord, Lord of all   Prince of Peace Perfect Healer All my life, all my cares on You King of Kings Mighty Savior All my life, all my cares on You  Prince of Peace Perfect Healer All my life, all my cares on You King of Kings Mighty Savior All my life, all my cares on You  All my cares are on You My hope, my dreams, my life, my life   I will look up for there is none above You I will bow down to tell you that I need You Jesus, Lord of all Jesus, Lord of all  I will look back and see that You are faithful I look ahead believing You are able Jesus, Lord of all Jesus, Lord of all   Jesus, Lord of all You're Jesus, Lord of all Our God is Jesus, Lord of all You are Jesus, Lord of all"
Hillsong Worship,Glorious Ruins , When the mountains fall and the tempest roars You are with me When creation folds Still my soul will soar on Your mercy   I'll walk through the fire with my head lifted high And my spirit revived in Your story And I'll look to the cross as my failure is lost In the light of Your glorious grace   So let the ruins come to life In the beauty of Your Name Rising up from the ashes God forever You reign And my soul will find refuge In the shadow of Your wings I will love You forever and forever I'll sing   When the world caves in Still my hope will cling to Your promise Where my courage ends Let my heart find strength in Your presence   I'll walk through the fire with my head lifted high And my spirit revived in Your story And I'll look to the cross as my failure is lost In the light of Your glorious grace   So let the ruins come to life In the beauty of Your Name Rising up from the ashes God forever You reign And my soul will find refuge In the shadow of Your wings I will love You forever and forever I'll sing   Oh oh Oh oh
Passion,Jesus Paid It All,"Andrae Crouch: I found Jesus Christ to be a healer and I tell you he's everything And I’m just trying to tell everybody all the young people especially In all thy ways acknowledge him and he'll direct your path you'll never regret Any moment that you’ve given your heart to Jesus    : God's got it so obviously we stopping it Christ crossed my mind so if Im lost it's cause I'm tossing it awesome pick a proverb Prolly toss ya what ya options is Showin where ya goin So expose where your foxes live Use to make decisions through the pickings in my head Didn't matter how it ended who it hurt Or what I did I'd think “I got away with it” and covered up my mess But repercussions came every way then I was dead That's The wages of sin You couldn’t pay me again To go back to the life where I was famously dim While shady as slim Almost making babies and kids Jim Couldn’t carry all the pain I was in Oh wretched man I am who will deliver me then ? Well it's Jesus Christ My Lord feeds me right Got the keys and he Washed me and he made me white Now He tells me how he love me sound like Barry white  : I’m up in paradise Fear is paralyzed Scared of heights? I'm about to tear the night Prepared for flight I dare to fight Amour of salvation making sure that I can wear it right There's fire in my eyes, I write my melodies in Fahrenheit I use to barley write, now I design rhymes in my mind And over time I intertwined All these blessings I can find Your sight Shouldn't stop you guys from pressing on your grind Cuz there’s Mountains there to climb Plus depressions on decline Thus a lesson from the blind Sight isn't anything Move by faith Despite of the petty things Refuse to differ Cuz my fuse won't give up And view a few, spew a few And use a few scriptures And the songs that were read to me still got the energy That his melodies have And the devil keep tempting me, God is my remedy When my head was in half And I'm drunk off his synergy No need for Hennessy, they got plenty of that I don't rock steady with that Letting me drop My God ain't finna do that because..  {Hook}: God's Got it, I ain't gon stop it Resting in his love got answers from above Minds poppin, Jesus be rockin Only one question, where ya put ya trust ?  : He closed the curtains on my burdens So his love is working great He's observant, I'm his servant Turned my worries into faith There be people steady working, tryna go impersonate Add some faith and agitate the devil when this sample breaks  : I'll take it further I don't hurry I'm just dwelling in his place Like the curry in the pot he's got a lot so we ate Feel it stirring know ya heard it Never curse his Great name We know that we Victorious Romans chapter 8  : Psalms 55 cast your burdens on the lord Spiritual sword Drawn weaponry Jesus Christ Who mentors me The prince of peace Kicking principalities He lives in me On my knees in my dreams Making it realty  : Jehovahs in nova scotia The Holy Ghost only flowin So No more stoning Knowing hills and the cattle he owns it Make a toast then It's a celebration Leaning on ourselves since the Fall of creation Peter Pan lost boi Needed a vacation Then went to the promise land Prayin up in Canaan Gives milk and honey His voice oh so lovely Calls me his buddy It goes his love I covet  : I know my foes don't run me Even the weathers so bummy Wherever I go is still sunny Cuz Jesus rose up above me Principalities causality causally made my life exist My life was passing me My mom actually asking me What my passion is Can't answer is it Yet my answer is Jesus Christ over all Body lacking fear every time People hear an alter call Some churches don't have it all Some churches Don't like rap at all Back when I was in the trap I sang the blues like Avatar  : Hasselholf Maybe a different David At the castle top Never Lost his God But he tossed the thoughts He had in psalms At the cross Jesus paid it all so the mantle dropped wisdom drops like honey kind of funny what the knowledge cost  {Interlude} Kenneth E. Hagin: “Casting how much?  All your cares, All your worries All your anxieties, All your care Once and for all, on Him”  {Hook}: God's Got it, I ain't gon stop it Resting in his love got answers from above Minds poppin, Jesus be rockin Only one question, where ya put ya trust ?"
Matt Redman,The Heart Of Worship," When the music fades All is stripped away And I simply come Longing just to bring Something that's of worth That will bless Your heart   I'll bring You more than a song For a song in itself Is not what You have required You search much deeper within Through the way things appear You're looking into my heart   I'm coming back to the heart of worship And it's all about You, it's all about You, Jesus I'm sorry, Lord, for the thing I've made it When it's all about You, it's all about You, Jesus   King of endless worth No one could express How much you deserve Though I'm weak and poor All I have is Yours Every single breath!   I'll bring You more than a song For a song in itself Is not what You have required You search much deeper within Through the way things appear You're looking into my heart, yeah   I'm coming back to the heart of worship And it's all about You, it's all about You, Jesus I'm sorry, Lord, for the thing I've made it When it's all about You, it's all about You, Jesus I'm coming back to the heart of worship And it's all about You, it's all about You, Jesus I'm sorry, Lord, for the thing I've made it When it's all about You, it's all about You, Jesus   All about you  I'll bring you more than a song I'll bring you more than a song More than a song I'll bring you more than a song I'll bring you more than a song   You're looking into my heart, looking into my heart You're looking into my heart  I'll bring You more than a song I'll bring You more than a song, yeeeah I'll bring You more than a song I'll bring You more than a song"
Elevation Worship,Raised to Life," Precious compassion that pours From the wounds that have won our salvation Sin was strong, but the Savior is stronger Come let us worship Him   Great was the debt that we owed And how high was the price of our healing Paid in full by the One who is worthy Come let us worship Him   Raised to life with Christ the Savior In His name a new creation Now our song will rise Adoring Christ the Lord   Death overcome by the Word That was spoken before it was finished Jesus saves is our song everlasting Come let us worship Him   Raised to life with Christ the Savior In His name a new creation Now our song will rise Adoring Christ the Lord   Sin was strong But Jesus is stronger Our shame was great But Jesus, You're greater Sin was strong But Jesus is stronger Our shame was great But Jesus, You're greater   Raised to life with Christ the Savior In His name a new creation Now our song will rise Adoring Christ the Lord   Sin was strong But Jesus is stronger Our shame was great But Jesus, You're greater Sin was strong But Jesus is stronger Our shame was great But Jesus, You're greater"
Gateway Worship,Alabaster Jar ," This alabaster jar is all I have of worth I break it at Your feet, Lord, it's less than You deserve You're far more beautiful, more precious than the oil The sum of my desires and the fullness of my joy Like You spilled Your blood, I spill my heart As an offering to my King   Here I am, take me as an offering Here I am, giving every heartbeat for Your glory Take me   This time that I have left is all I have of worth I lay it at Your feet, Lord, it's less than You deserve And though I've little strength, and though my days are Few You gave Your life for me so I will live my life for You Like You spilled Your blood, I spill my heart As an offering to my King   Here I am, take me as an offering Here I am, giving every heartbeat for Your glory Here I am, take me as an offering Here I am, giving every heartbeat for Your glory, take Me   Worthy, worthy, You are worthy, worthy is the Lord Worthy, worthy, You are worthy, worthy is the Lord Worthy, worthy, You are worthy, worthy is the Lord Worthy, worthy, You are worthy, worthy is the Lord"
Passion,This We Know ," You are who say You are You'll do what You say You'll do You’ll be who You’ve always been to us Jesus   Our hope is in You alone Our strength in your mighty name Our peace in the darkest day remains Jesus   This we know We will see the enemy run This we know We will see the victory come We hold on to every promise You ever made Jesus, You are unfailing   Our God through the wilderness And our joy in the heaviness Our way when it seems there is no way Jesus   This we know We will see the enemy run This we know We will see the victory come We hold on to every promise You ever made Jesus, You are unfailing   We trust You We trust You Your ways are higher than our own    This we know We will see the enemy run This we know We will see the victory come We hold on to every promise You ever made Jesus, You are unfailing    Jesus, You are unfailing Jesus, You are unfailing"
Shane & Shane,I Will Wait for You (Psalm 130) [Live],"Big Daddy Weave - Alive Hillsong UNITED - As You Find Me  1K Phew, Ty Brasel - How We Coming Christy Nockels - In Every Way Radiate Worship - Back To You Hollyn - Good Times Shane & Shane - I Will Wait for You   The Choir, Leigh Nash - After All  ** Liturgical Folk, Josh Garrels - Lent 3: Delight in the Lord Daniela Galeano - Me Acerco a Ti Elias Dummer - The Work  Lord Badu - Grateful IFGF Praise - 一日勝於千日 The Color - The Kind of Man Switch, Dillon Chase - Symphony Corey Voss, Madison Street Worship - Liberator  Jim Brickman - The Water Is Wide Meredith Andrews - Open Over Us  Samuel Ljungblahd - Letting Go Corey Wise, Tre'gadd - Can't Believe It Preto no Branco - Se Organize DAMIAN - Light Todd Galberth - For My Good Sara Groves - Jesus, See The Traveler Central 3 - Tua Glória Que Me Beija  ØM-53 - Scars Byron Juane - Elevate  ** Esther Lozano - Sonrisa Rota Isla Vista Worship - Captured LIVLIV, vinifecampos - I Love You So Danilo Montero - ¿A Quién Tengo Yo? En Vivo LW Music, Garett Serban - King of Eternity Patrick Aurelle, Leonsè - Redemption Atlas Rhoads - Nothing Can Tear  Ginny Owens - Echo Redimi2 - La Praxis Freestyle Young C - Gods Image Alfred YAO, Alima - Saved soul  Cross Church Worship - Who May Ascend Nick Brinner - On My Knees Kemuel - Esperança  CF Worship - A Love Like This Discopraise - Pertenço a Ti Michael & Becci Ball - Worth My Time Steven Cravis - River Vin Bogart - Found Myself Bonray - love u forever Yari Brandao - Conmigo Estás Angeldan - Primicia Furnace Worship - From the Ends of the Earth  JPPC Worship - Inochi No Hi No Kagiri  ProJudah - Totally Stress Free  Gabriela Gomes, Luma Elpidio - O Nome Alive Worship - Battle Cry  Molly Marrs - All of Me Jason Barrows - Edge of My Heart Charles Wisdom - Heaven or Hell  Micah | Michelle - Out of the Dark NDC Worship - Overture  Lori Shuck - Love One Another Daniel Lindahl - Canvas Jon Mark - Chasing Clouds St. Unlikely - Every Breath Victory Worship - Tribes Jason Barrows - Empty Hands David Daniells - Like a River Andrew Jeter - Wheat Anna Cano - Salmos 63 Josh Holsey - Fire Rich Tyler - Fly Away Chatty - Be Free Raymond Hess - My Time Jrap - Questions Tarblossom - When the Lion Roars  Mr. Don - Sin Tu Amor Yung Kriss - Reach Brettan Cox - Lack Nothing H4C - Goodbye Rony G - Caminando Rebeca Carvalho - Te Venero Trey Hill, Tray Little - Let It Shine Ashtyn Michael - No Other Name Mark Fonseca - Almost See the Light Paul Hernandez - Time Flies Dianne Michelle - Let It Be Evident"
Tree63,King,We have heard the thunder We have seen the storm Echoes of your kingdom coming Rumors of our home Where one day we will stand before you Lord Our altogether beautiful reward  And we will give you glory bring you honor King above all kings You deserve our everything We will lift our voices with your praises Jesus you are our king  Though now we walk in darkness Though now we see in part Right now we're warmed by the burning flames Of the fire in our hearts You've promised you would lead us to your throne Where we will worship you and you alone  And we will give you glory bring you honor King above all kings You deserve our everything We will lift our voices with your praises Jesus you are our king
Hillsong Young & Free,Sinking Deep," Standing here in Your presence In a grace so relentless I am won By perfect love Wrapped within the arms of heaven In a peace that lasts forever Sinking deep In mercy's sea   I'm wide awake Drawing close Stirred by grace and All my heart is Yours All fear removed I breathe You in I lean into Your love Oh, Your love   When I'm lost You pursue me Lift my head to see Your glory Lord of all So beautiful Here in You I find shelter Captivated by the splendour Of Your face My secret place   I'm wide awake Drawing close Stirred by grace and All my heart is Yours All fear removed I breathe You in I lean into Your love Oh, Your love   Your love so deep Is washing over me Your face is all I seek You are my everything Jesus Christ You are my one desire Lord hear my only cry To know You all my life Your love so deep Is washing over me Your face is all I seek You are my everything Jesus Christ You are my one desire Lord hear my only cry To know You all my life   I'm wide awake Drawing close Stirred by grace and All my heart is Yours All fear removed I breathe You in I lean into Your love Oh, Your love"
Hillsong Worship,Awake My Soul, There is a sound I love to hear It’s the sound of the Saviour’s robe As He walks into the room where people pray Where we hear praises He hears faith   There is a sound I love to hear It’s the sound of the Saviour’s robe As He walks into the room where people pray Where we hear worship He hears faith   Awake my soul and sing Sing His praise aloud Sing His praise aloud  Awake my soul and sing Sing His praise aloud Sing His praise aloud   There is a sound that changes things The sound of His people on their knees Oh wake up you slumbering It’s time to worship Him   Awake my soul and sing Sing His praise aloud Sing His praise aloud  Awake my soul and sing Sing His praise aloud Sing His praise aloud   And when He moves And when we pray Where stood a wall now stands a way Where every promise is amen  And when He moves Make no mistake The bowels of hell begin to shake All hail the Lord all hail the King   Hey oh Oh let the King of glory enter in Hey oh Fall down on your knees and worship Him Hey oh Let His praise rise up don’t hold it in   Awake my soul and sing Sing His praise aloud Sing His praise aloud  Awake my soul and sing Sing His praise aloud Sing His praise aloud
